{
  "$schema": "./schema/catalog.schema.json",
  "schemaVersion": 1,
  "catalogVersion": "3.1.0",
  "name": "Catalogue PowerShell Microsoft 365",
  "description": "Sources, regles de compatibilite PowerShell 7, index publies et annotations pour PS Admin Launcher. Seuls des scripts lancables sont references.",
  "okLabel": "PS7",
  "indexBaseUrl": "https://raw.githubusercontent.com/hbasiitelecom/ps-admin-catalog/index/",
  "sources": [
    {
      "id": "admindroid",
      "name": "AdminDroid Community",
      "owner": "admindroid-community",
      "repo": "powershell-scripts",
      "branch": "master",
      "layout": "folders",
      "trust": "community",
      "license": "aucune",
      "note": "183 scripts autonomes, un dossier par script avec son README. Aucune licence declaree : usage interne uniquement.",
      "enabled": true
    },
    {
      "id": "o365itpros",
      "name": "Office365ITPros",
      "owner": "12Knocksinna",
      "repo": "Office365itpros",
      "branch": "master",
      "layout": "flat",
      "trust": "verified",
      "license": "MIT",
      "note": "406 scripts autonomes a la racine du depot. Source de reference de la communaute M365, active. Pas de README par script : la documentation vient de l'en-tete.",
      "enabled": false
    },
    {
      "id": "mike-crowley",
      "name": "Mike Crowley - Public Scripts",
      "owner": "Mike-Crowley",
      "repo": "Public-Scripts",
      "branch": "main",
      "layout": "tree",
      "trust": "community",
      "license": "GPL-3.0",
      "note": "38 scripts M365, Exchange, SharePoint, Entra. Petit mais qualitatif.",
      "enabled": false
    },
    {
      "id": "m365corner",
      "name": "M365Corner",
      "owner": "m365corner",
      "repo": "M365Corner-Scripts",
      "branch": "main",
      "layout": "tree",
      "trust": "unknown",
      "license": "aucune",
      "note": "Scripts Graph orientes resolution de problemes. Aucune licence declaree, depot recent.",
      "enabled": false
    },
    {
      "id": "exchange4itpros",
      "name": "Exchange4ITPros",
      "owner": "Apoc70",
      "repo": "Exchange4ITPros",
      "branch": "main",
      "layout": "tree",
      "trust": "community",
      "license": "MIT",
      "note": "Structure par service, un README par script. Seulement 14 fichiers .ps1 : verifier le rendement avant activation.",
      "enabled": false
    },
    {
      "id": "msendpointmgr",
      "name": "MSEndpointMgr - Intune",
      "owner": "MSEndpointMgr",
      "repo": "Intune",
      "branch": "master",
      "layout": "tree",
      "trust": "verified",
      "license": "MIT",
      "note": "Intune et gestion du parc. 62 fichiers .ps1, structure mixte : verifier l'eligibilite avant activation.",
      "enabled": false
    },
    {
      "id": "devolutions",
      "name": "Devolutions ScriptLibrary",
      "owner": "Devolutions",
      "repo": "ScriptLibrary",
      "branch": "main",
      "layout": "tree",
      "trust": "community",
      "license": "aucune",
      "note": "Administration IT generale : AD, Azure, DNS, Entra, M365, Intune. Aucune licence declaree.",
      "enabled": false
    },
    {
      "id": "365inspect",
      "name": "365Inspect",
      "owner": "soteria-security",
      "repo": "365Inspect",
      "branch": "main",
      "layout": "tree",
      "trust": "verified",
      "license": "MIT",
      "note": "Deux points d'entree : 365Inspect.ps1, qui mene l'audit, et Create-365InspectApp.ps1, qui prepare l'application Entra. Les 108 fichiers d'Inspectors/ sont des fonctions appelees par le premier.",
      "enabled": false,
      "include": [
        "/365inspect.ps1",
        "/create-365inspectapp.ps1"
      ]
    },
    {
      "id": "mggraph-intune",
      "name": "Microsoft Graph Intune Samples",
      "owner": "microsoft",
      "repo": "mggraph-intune-samples",
      "branch": "main",
      "layout": "tree",
      "trust": "official",
      "license": "MIT",
      "note": "Exemples Intune sur le SDK Graph. Remplace microsoftgraph/powershell-intune-samples, desormais en lecture seule.",
      "enabled": false
    }
  ],
  "services": [
    {
      "id": "exo",
      "label": "Exchange Online",
      "icon": "E715",
      "pattern": "Connect-ExchangeOnline"
    },
    {
      "id": "graph",
      "label": "Microsoft Graph/Entra",
      "icon": "E753",
      "pattern": "Connect-MgGraph"
    },
    {
      "id": "spo",
      "label": "SharePoint/OneDrive",
      "icon": "E8B7",
      "pattern": "Connect-PnPOnline|Connect-SPOService"
    },
    {
      "id": "teams",
      "label": "Microsoft Teams",
      "icon": "E716",
      "pattern": "Connect-MicrosoftTeams"
    },
    {
      "id": "scc",
      "label": "Securite & Conformite",
      "icon": "E72E",
      "pattern": "Connect-IPPSSession"
    },
    {
      "id": "aad",
      "label": "Azure AD (obsolete)",
      "icon": "E7BA",
      "pattern": "Connect-MsolService|Connect-AzureAD"
    }
  ],
  "rules": [
    {
      "id": "retired-modules",
      "severity": "broken",
      "label": "Obsolete",
      "pattern": "Connect-MsolService|Connect-AzureAD\\b|Import-Module\\s+\\W{0,2}MSOnline|Import-Module\\s+\\W{0,2}AzureAD|\\bGet-Msol|\\bSet-Msol|\\bNew-Msol|\\bGet-AzureAD|\\bSet-AzureAD|\\bNew-AzureAD|\\bGet-WmiObject\\b",
      "reason": "Ce script s'appuie sur les modules MSOnline / AzureAD (ou sur Get-WmiObject), retires par Microsoft et non supportes par PowerShell 7. Il ne fonctionnera pas en l'etat : l'equivalent moderne passe par Microsoft Graph PowerShell."
    },
    {
      "id": "spo-legacy-module",
      "severity": "warn",
      "label": "A verifier",
      "pattern": "Connect-SPOService|Import-Module\\s+\\W{0,2}Microsoft\\.Online\\.SharePoint\\.PowerShell",
      "reason": "Ce script utilise le module Microsoft.Online.SharePoint.PowerShell, qui n'est pas nativement compatible PowerShell 7. Importez-le avec : Import-Module Microsoft.Online.SharePoint.PowerShell -UseWindowsPowerShell"
    }
  ],
  "overrides": [],
  "tasks": [
    {
      "id": "m365-remove-accounts",
      "label": "Supprimer des comptes Microsoft 365",
      "keywords": [
        "compte",
        "comptes",
        "inactif",
        "inactifs",
        "offboarding",
        "depart",
        "desactive"
      ],
      "impact": "destructif",
      "signature": [
        "Remove-MgUser",
        "Remove-MgDirectoryDeletedItem",
        "Remove-MsolUser"
      ]
    },
    {
      "id": "m365-compromised-account",
      "label": "Réagir à un compte compromis",
      "keywords": [
        "compte",
        "comptes",
        "compromis",
        "compromise",
        "piratage",
        "pirate",
        "incident",
        "session",
        "sessions",
        "jeton",
        "exfiltration",
        "securite"
      ],
      "impact": "destructif",
      "signature": [
        "Revoke-MgUserSignInSession",
        "Revoke-MgUserSign"
      ]
    },
    {
      "id": "exo-outlook-signature",
      "label": "Déployer une signature Outlook",
      "keywords": [
        "signature",
        "signatures",
        "outlook",
        "owa",
        "pied",
        "papier"
      ],
      "impact": "modification",
      "signature": [
        "Set-MailboxMessageConfiguration"
      ]
    },
    {
      "id": "entra-mfa-reset",
      "label": "Réinitialiser l'authentification forte d'un utilisateur",
      "keywords": [
        "mfa",
        "authentification",
        "forte",
        "multifacteur",
        "telephone"
      ],
      "impact": "destructif",
      "signature": [
        "Remove-MgUserAuthenticationPhoneMethod",
        "Remove-MgUserAuthenticationMethod"
      ]
    },
    {
      "id": "exo-dl-to-group",
      "label": "Convertir une liste de distribution en groupe Microsoft 365",
      "keywords": [
        "distribution",
        "liste",
        "dl",
        "groupe",
        "unified",
        "conversion"
      ],
      "impact": "modification",
      "signature": [
        "New-UnifiedGroup"
      ]
    },
    {
      "id": "entra-group-membership",
      "label": "Copier ou synchroniser l'appartenance d'un groupe",
      "keywords": [
        "appartenance",
        "membre",
        "membres",
        "groupe",
        "groupes",
        "dynamique"
      ],
      "impact": "modification",
      "signature": [
        "New-MgGroupMember",
        "Add-DistributionGroupMember",
        "Add-UnifiedGroupLinks"
      ]
    },
    {
      "id": "m365-license-assign",
      "label": "Attribuer ou retirer des licences",
      "keywords": [
        "licence",
        "licences",
        "abonnement",
        "sku",
        "affectation"
      ],
      "impact": "modification",
      "signature": [
        "Set-MgUserLicense",
        "Set-MsolUserLicense"
      ]
    },
    {
      "id": "spo-version-cleanup",
      "label": "Nettoyer l'historique de versions SharePoint",
      "keywords": [
        "version",
        "versions",
        "versioning",
        "historique",
        "purge",
        "nettoyage",
        "stockage",
        "quota",
        "sharepoint"
      ],
      "impact": "destructif",
      "signature": [
        "Remove-PnPFileVersion",
        "Remove-MgDriveItemVersion",
        "Set-PnPListVersionHistory"
      ]
    },
    {
      "id": "exo-auto-reply",
      "label": "Configurer un message d'absence",
      "keywords": [
        "absence",
        "absent",
        "reponse",
        "automatique",
        "oof",
        "vacances",
        "conge"
      ],
      "impact": "modification",
      "signature": [
        "Set-MailboxAutoReplyConfiguration"
      ]
    }
  ]
}
